{
  "dataset": "taskpilot_core_final",
  "version": "1.0.0",
  "split": "independent_holdout",
  "frozen_at_utc": "2026-10-11T08:24:40.590116+00:00",
  "source_catalog_sha256": "603298bda9d4ac54650cbbebcc74da09c958f013d914679dde0bfb85ae626f3e",
  "scoring_sha256": "289db810fda451dee8a6d9aa2765e79995eae2b38401c1512da249b547608c2a",
  "prior_sets": [
    {
      "path": "eval/datasets/routing_v1_experiment.json",
      "version": "1.1.0",
      "role": "k_selection_experiment",
      "sample_count": 28,
      "sha256": "38fa5d0f48c7e6159adff464c20f417d43b928fbad85028fbe3b0f1ff1cf87eb"
    },
    {
      "path": "eval/datasets/routing_v1_evaluation.json",
      "version": "1.1.0",
      "role": "routing_stage_evaluation_used_in_t030",
      "sample_count": 12,
      "sha256": "31bd9377edd126d3a4ce1910c477b8b57792e508e41efc33db85f697d87a81a6"
    }
  ],
  "profiles": [
    {
      "id": "github_readonly",
      "source": "local",
      "tools": [
        "github_repository_info",
        "github_issue_search",
        "github_issue_detail",
        "github_code_search",
        "github_read_file"
      ],
      "control_tools": [
        "terminate"
      ]
    },
    {
      "id": "mcp_stdio_v1",
      "source": "mcp",
      "tools": [
        "mcp_fixture_echo_read",
        "mcp_fixture_fail_read",
        "mcp_fixture_legacy_read",
        "mcp_fixture_server_pid",
        "mcp_fixture_slow_read"
      ],
      "control_tools": [
        "terminate"
      ]
    },
    {
      "id": "mcp_stdio_v2",
      "source": "mcp",
      "tools": [
        "mcp_fixture_echo_read",
        "mcp_fixture_fail_read",
        "mcp_fixture_new_read",
        "mcp_fixture_server_pid",
        "mcp_fixture_slow_read"
      ],
      "control_tools": [
        "terminate"
      ]
    }
  ],
  "samples": [
    {
      "id": "core-001",
      "category": "repository_understanding",
      "task": "At the pinned encode/httpx revision, identify two documented HTTP client capabilities and cite the README.",
      "profile": "github_readonly",
      "source_id": "httpx",
      "context": {
        "repository": "encode/httpx",
        "ref": "b5addb64f0161ff6bfe94c124ef76f6a1fba5254",
        "provenance": "confirmed_user",
        "issue_number": null
      },
      "setup": {
        "mode": "natural_task"
      },
      "steps": [
        {
          "index": 1,
          "observation": null,
          "expected_action": "tool",
          "acceptable_tools": [
            "github_read_file"
          ],
          "pending_tool": null,
          "selection_eligible": true,
          "critical_slots": {
            "repository": {
              "source": "confirmed_context",
              "value": "encode/httpx"
            },
            "ref": {
              "source": "confirmed_context",
              "value": "b5addb64f0161ff6bfe94c124ef76f6a1fba5254"
            },
            "path": {
              "source": "task",
              "value": "README.md"
            }
          },
          "expected_execution": {
            "tool_dispatches": 1,
            "transport_attempts": 1,
            "status": "success"
          },
          "label_rationale": "The requested README path is explicit; read the pinned file."
        }
      ],
      "business_evidence": [
        {
          "kind": "github_file",
          "source_ref": "httpx:README.md",
          "criterion": "Pinned README content supports two stated HTTP client capabilities."
        },
        {
          "kind": "answer_citation",
          "source_ref": "httpx:README.md",
          "criterion": "Answer cites the pinned README URL, not an unpinned branch."
        }
      ],
      "failure_conditions": [
        "Required evidence is missing, contradicted, or only asserted by terminate(success)."
      ],
      "unsupported_conditions": [
        "Required profile tool or read-only transport is absent at preflight; report unsupported before execution."
      ]
    },
    {
      "id": "core-002",
      "category": "repository_understanding",
      "task": "At this pinned Rich revision, explain how Rich presents terminal output using its README as evidence.",
      "profile": "github_readonly",
      "source_id": "rich",
      "context": {
        "repository": "Textualize/rich",
        "ref": "9d8f9a372cc5916fd4781fec207ced7ddac2f08f",
        "provenance": "confirmed_user",
        "issue_number": null
      },
      "setup": {
        "mode": "natural_task"
      },
      "steps": [
        {
          "index": 1,
          "observation": null,
          "expected_action": "tool",
          "acceptable_tools": [
            "github_read_file"
          ],
          "pending_tool": null,
          "selection_eligible": true,
          "critical_slots": {
            "repository": {
              "source": "confirmed_context",
              "value": "Textualize/rich"
            },
            "ref": {
              "source": "confirmed_context",
              "value": "9d8f9a372cc5916fd4781fec207ced7ddac2f08f"
            },
            "path": {
              "source": "task",
              "value": "README.md"
            }
          },
          "expected_execution": {
            "tool_dispatches": 1,
            "transport_attempts": 1,
            "status": "success"
          },
          "label_rationale": "README is named in the task and contains overview evidence."
        }
      ],
      "business_evidence": [
        {
          "kind": "github_file",
          "source_ref": "rich:README.md",
          "criterion": "Pinned README describes terminal presentation features."
        },
        {
          "kind": "answer_citation",
          "source_ref": "rich:README.md",
          "criterion": "Answer cites the pinned README."
        }
      ],
      "failure_conditions": [
        "Required evidence is missing, contradicted, or only asserted by terminate(success)."
      ],
      "unsupported_conditions": [
        "Required profile tool or read-only transport is absent at preflight; report unsupported before execution."
      ]
    },
    {
      "id": "core-003",
      "category": "issue_investigation",
      "task": "Investigate encode/httpx issue #895: what cookie persistence problem was reported?",
      "profile": "github_readonly",
      "source_id": "httpx",
      "context": {
        "repository": "encode/httpx",
        "ref": "b5addb64f0161ff6bfe94c124ef76f6a1fba5254",
        "provenance": "confirmed_user",
        "issue_number": 895
      },
      "setup": {
        "mode": "natural_task"
      },
      "steps": [
        {
          "index": 1,
          "observation": null,
          "expected_action": "tool",
          "acceptable_tools": [
            "github_issue_detail"
          ],
          "pending_tool": null,
          "selection_eligible": true,
          "critical_slots": {
            "repository": {
              "source": "confirmed_context",
              "value": "encode/httpx"
            },
            "ref": {
              "source": "confirmed_context",
              "value": "b5addb64f0161ff6bfe94c124ef76f6a1fba5254"
            },
            "issue_number": {
              "source": "task",
              "value": 895
            }
          },
          "expected_execution": {
            "tool_dispatches": 1,
            "transport_attempts": 1,
            "status": "success"
          },
          "label_rationale": "Issue number is explicit; direct issue detail is sufficient."
        }
      ],
      "business_evidence": [
        {
          "kind": "github_issue",
          "source_ref": "httpx#issue:895",
          "criterion": "Issue #895 body supports the reported cookie save/load or conflict behavior."
        },
        {
          "kind": "answer_citation",
          "source_ref": "httpx#issue:895",
          "criterion": "Answer cites issue #895 and distinguishes report from a fix."
        }
      ],
      "failure_conditions": [
        "Required evidence is missing, contradicted, or only asserted by terminate(success)."
      ],
      "unsupported_conditions": [
        "Required profile tool or read-only transport is absent at preflight; report unsupported before execution."
      ]
    },
    {
      "id": "core-004",
      "category": "issue_investigation",
      "task": "Inspect Textualize/rich issue #4171 and summarize the requested Table title typing change.",
      "profile": "github_readonly",
      "source_id": "rich",
      "context": {
        "repository": "Textualize/rich",
        "ref": "9d8f9a372cc5916fd4781fec207ced7ddac2f08f",
        "provenance": "confirmed_user",
        "issue_number": 4171
      },
      "setup": {
        "mode": "natural_task"
      },
      "steps": [
        {
          "index": 1,
          "observation": null,
          "expected_action": "tool",
          "acceptable_tools": [
            "github_issue_detail"
          ],
          "pending_tool": null,
          "selection_eligible": true,
          "critical_slots": {
            "repository": {
              "source": "confirmed_context",
              "value": "Textualize/rich"
            },
            "ref": {
              "source": "confirmed_context",
              "value": "9d8f9a372cc5916fd4781fec207ced7ddac2f08f"
            },
            "issue_number": {
              "source": "task",
              "value": 4171
            }
          },
          "expected_execution": {
            "tool_dispatches": 1,
            "transport_attempts": 1,
            "status": "success"
          },
          "label_rationale": "Direct issue detail addresses the requested report."
        }
      ],
      "business_evidence": [
        {
          "kind": "github_issue",
          "source_ref": "rich#issue:4171",
          "criterion": "Issue #4171 describes Table title typing request."
        },
        {
          "kind": "answer_citation",
          "source_ref": "rich#issue:4171",